"entrykey";"entryterm";"entrytermabbr";"entrytermdef";"entrytermlastmod"
"101";"anemometers";"";"Instrument that measures wind speed and direction at a single elevation.";"2013-02-26"
"102";"meteorological packages";"";"Instrument that makes routine meteorological measurements on the atmosphere, typically air pressure, temperature and humidity.";"2013-02-26"
"103";"radiosondes";"";"A balloon-borne package equipped with a radio transmitter and meteorological sensors typically measuring temperature, pressure, and humidity.";"2007-11-20"
"11";"discrete air samplers";"";"A device that collects a sample of air from the atmosphere and stores it, usually under pressure, for subsequent analysis.";"2013-02-26"
"110";"wave recorders";"";"Instrument that measures water column surface wave parameters including height, period, direction and energy spectra.";"2007-11-20"
"111";"sea level recorders";"";"Instrument that make smoothed measuremeants of the elevation of the sea surface relative to a fixed vertical datum.";"2013-02-26"
"112";"inverted echosounders";"";"Instruments that locate acoustic reflectors such as fronts in the water column by transmitting pulses of sound from the seabed and determing reflection return times.";"2013-02-26"
"113";"fluorometers";"";"Instrument that measures the amount of stimulated electromagnetic radiation produced by pulses of electromagnetic radiation emitted into the water column.";"2013-02-26"
"114";"current meters";"";"Instrument that measures current speed and direction at a single depth.";"2013-02-26"
"115";"current profilers";"";"Instrument that measures current speed and direction at multiple predetermined depths simultaneously.";"2013-02-26"
"116";"lowered current profilers";"";"An acoustic doppler current meter lowered and raised vertically from a surface platform, typically a ship.";"2007-11-20"
"12";"fog samplers";"";"A device that condenses a sample of fog from the atmosphere.";"2013-02-26"
"121";"satellite tracking system";"";"A network of statellites that determines the position of a transponder by triangulation such as Argos.  Generally used to track surface buoys for the determination of Lagrangian currents.";"2007-11-20"
"122";"radiometers";"";"Instrument that measures the intensity of electromagnetic radiation in either the atmosphere or the water column.";"2013-02-26"
"123";"optical backscatter sensors";"";"Instrument that measures the amount of electromagnetic radiation emitted into the water column returned to the instrument.";"2007-11-20"
"124";"transmissometers";"";"Systems that measure the attenuation of electromagnetic radiation by the water column. Includes human observer plus Secchi Disk.";"2007-11-20"
"13";"aerosol samplers";"";"A device that collects a sample of aerosol (dry particles or liquid droplets) from the atmosphere.";"2013-02-26"
"130";"CTD";"";"A package lowered and raised vertically from a surface platform, usually a ship, always carrying pressure, temperature and conductivity sensors. Addional optional sensors include fluorometers, transmissometers and radiometers.  The package may also carry water bottles.";"2010-11-18"
"131";"CTD undulators";"";"A package towed at varying depths by a ship, always carrying pressure, temperature and conductivity sensors. Addional optional sensors include fluorometers, transmissometers and radiometers.";"2007-11-20"
"132";"bathythermographs";"";"Instruments that measure vertical profiles of sea temperature by either lowering a pressure plus temperature senor package (MBT) or dropping a free falling disposable sensor (XBT).";"2007-11-20"
"133";"thermosalinographs";"";"Temperature and conductivity sensors mounted on a sea-surface platform continuously measuring a surface water supply.";"2007-11-20"
"134";"water temperature sensor";"";"An instrument that measures the temperature of the water with which it is in contact.";"2013-02-26"
"135";"thermistor chains";"";"A group of rigidly-mounted temperature sensors sampled by a common data logger held at various depths in the water column.";"2007-11-20"
"14";"precipitation samplers";"";"A device that collects a sample of precipitation (rain, hail or snow) as it falls.";"2013-02-26"
"150";"particle sizers";"";"An instrument that measures the size spectrum of particles suspended in the water column.";"2013-02-26"
"151";"benthic incubation chambers";"";"A device that isolates a portion of seabed plus overlying water from its surroundings. Either returns the entire system to the surface or incorporates sampling devices and/or in-situ sensors.";"2008-01-10"
"152";"sidescan sonars";"";"Instruments with directional acoustic transmitters and receivers fitted to an underwater platform that emit fan-shaped pulses down toward the seafloor across a wide angle perpendicular to the path of the platform through the water.";"2007-11-20"
"153";"single-channel seismic reflection systems";"";"An energy source of unspecified frequency plus a single string of towed hydrophones (streamer) that determine geologic structure by detecting waves reflected by subsurface layers.";"2010-02-19"
"154";"multi-channel seismic reflection systems";"";"An energy source of unspecified frequency plus a multiple strings of towed hydrophones (streamers) that determine geologic structure by detecting waves reflected by subsurface layers.";"2010-02-19"
"155";"seismic refraction systems";"";"A network of seismometers or geophones plus an energy source that determine geologic structure by detecting waves refracted by subsurface layers.";"2007-11-20"
"156";"single-beam echosounders";"";"Instruments that measure water depth at a single point below the platform by timing pulses of sound reflected on the seafloor.";"2013-02-26"
"157";"multi-beam echosounders";"";"Instruments that measure water depth along several tracks parallel to the platform track by timing pulses of sound reflected on the seafloor.";"2013-02-26"
"158";"gravimeters";"";"Instrument that makes measurements of the Earth's gravity field.";"2013-02-26"
"159";"magnetometers";"";"Instrument that makes measurements of the Earth's magnetic field.";"2013-02-26"
"180";"underwater cameras";"";"All types of photographic equipment that may be deployed underwater including stills, video, film and digital systems.";"2013-02-26"
"181";"nutrient analysers";"";"Instrument that makes in-situ measurements of one or more of nitrate, nitrite, ammonium, urea, phosphate or silicate dissolved in the water column.";"2013-02-26"
"182";"inapplicable";"";"There is no appropriate value. To be used in cases where metadata elements cannot be set null due to schema constraints.";"2011-08-26"
"183";"acoustic backscatter sensors";"";"Instrument that measures the amount of sound energy transmitted into the water column returned to the instrument.";"2007-11-20"
"184";"microstructure sensors";"";"Fast response sensors sampled at high frequency to determine the distribution of water body properties on a millimetric scale.";"2012-02-23"
"185";"sound velocity sensors";"";"Instrument that measures the velocity of sound in seawater.";"2013-02-26"
"186";"radar altimeters";"";"Instruments that determine the distance between the platform and the Earth's surface by timing reflected electromagnetic radiation, usually microwaves.";"2011-04-15"
"21";"plankton recorders";"";"A device that continuously samples a flow of water, separating and fixing plankton for subsequent identification and counting.";"2013-02-26"
"22";"plankton nets";"";"A fine-meshed net designed for sampling microzooplankton, mesozooplankton or nekton.";"2007-11-20"
"23";"pelagic trawl nets";"";"A net towed through the water column designed to sample free-swimming nekton or fish.";"2007-11-20"
"24";"benthos samplers";"";"A net or sledge dragged across the seabed designed to sample benthic fauna.";"2007-11-20"
"30";"discrete water samplers";"";"A device that collects an in-situ discrete water sample from any depth and returns it to the surface without contamination by the waters through which it passes, such as a water bottle.";"2013-02-26"
"301";"satellite positioning systems";"";"A network of statellites that generate signals that allow a receiver to determine its position such as GPS.";"2007-11-20"
"302";"water body temperature sensor";"";"Sensors that measure the intensity and nature of electromagnetic radiation emitted from the Earth in a manner optimised for the determination of water body surface temperature.";"2010-11-19"
"303";"surface current radars";"";"Instruments that measure the speed and direction of sea surface travel by timing reflected radio waves.";"2013-02-26"
"304";"ocean colour radiometers";"";"Sensors that measure the intensity and nature of electromagnetic radiation in a manner optimised for the determination of ocean chlorophyll concentration.";"2008-01-10"
"305";"scatterometers";"";"Sensors that measure the reflection or scattering effect produced while scanning the surface of the earth. Primarily used to measure near surface winds over the oceans.";"2007-11-20"
"306";"synthetic aperture radars";"";"Instruments that generate maps of radar reflectivity through the synthesis of multiple pulses from a moving platform.";"2008-01-10"
"307";"accelerometers";"";"Instruments that measure non-gravitational accelerations acting upon a spacecraft.";"2008-01-10"
"308";"atmospheric radiometers";"";"Sensors that measure the intensity an nature of electromagnetic radiation in a manner optimised for the quantification of atmospheric phenomena.";"2008-01-10"
"309";"terrestrial radiometers";"";"Sensors that measure the intensity and nature of electromagnetic radiation in a manner optimised for the quantification of terrestrial phenomena.";"2008-01-10"
"31";"continuous water samplers";"";"A device that continuously supplies a flow of water either to an analytical instrument, over a sensor or from which samples may be drawn.";"2013-02-26"
"310";"laser altimeters";"";"Instruments that determine the distance between the platform and the Earth's surface by timing reflected pulses of laser light.";"2012-12-18"
"311";"cameras";"";"All types of photographic equipment that may be deployed in aircraft or satellites including stills, video, film and digital systems.";"2008-01-10"
"312";"bathymetric LiDARs";"";"Instruments that measure the depth of a water body by determining the distances from the platform to the surface and the bed by timing reflected pulses of laser light.";"2009-10-16"
"313";"bird detection radars";"";"X-band and S-band radar systems developed for the detection, tracking and counting of birds in flight.";"2013-02-26"
"32";"particulates samplers";"";"A system that collects samples of water column particulates such as in-situ high volume filtration systems liks SAPs.";"2007-11-20"
"33";"sediment traps";"";"A collector of particulates as they sink through the water column.";"2013-02-26"
"350";"salinity sensor";"";"Instrument that simultaneously measures electrical conductivity and temperature in the water column to provide temperature and salinity data.";"2013-02-26"
"351";"dissolved gas sensors";"";"Instrument that measures the concentration of gases, generally oxygen, dissolved in the water column.";"2013-02-26"
"352";"plankton counters";"";"Instruments that categorise and count plankton in the water column.";"2013-02-26"
"353";"active fluorometers";"";"Fluorometers that measure photosynthetic parameters by taking measurements whilst manipulating the phytoplankton with controlled high-intensity illumination such as pump and probe and FRRF.";"2013-02-26"
"354";"expendable CTDs";"";"Instruments that measure vertical profiles of sea temperature and salinity with a free falling disposable temperature and conductivity sensor package.";"2007-11-20"
"355";"pH sensors";"";"Instruments that measure the hydrogen ion concentration in the water column.";"2013-02-26"
"356";"redox potential sensors";"";"Instruments that measure the tendency of the water column to either gain or lose electrons when it is subject to change by introduction of a new species.";"2013-02-26"
"357";"acoustic tracking systems";"";"A network of acoustic sensors that determine the location of a sound source by triangulation such as acoustically active float tracking systems.";"2011-02-02"
"358";"bubble detectors";"";"Instruments that measure the concentration and size of air bubbles in the water column.";"2008-01-10"
"359";"plummets";"";"Devices comprising a weight attached to the end of a graduated rope used to measure point water depths.";"2010-02-19"
"360";"piezometers";"";"Devices that measure fluid  (air, gas, water, or oil) pressure within soil, sediment, rock or concrete providing information such as water table level in an aquifer system.";"2010-02-19"
"361";"penetrometers";"";"Dynamic or passive devices that determine the consistency or hardness of soil or sediment by measuring the depth or rate of penetration of a needle or cone rig into it when a known force is applied.";"2010-02-19"
"362";"250 Hz top-bandwidth single-channel seismic reflection systems";"";"An energy source with a frequency up to 250 Hz (sampling interval ranging from 2-8 msec) plus a single string of towed hydrophones (streamer) that determine geologic structure by detecting waves reflected by subsurface layers.";"2010-02-19"
"363";"1000 Hz top-bandwidth single-channel seismic reflection systems";"";"An energy source with a frequency up to 1000 Hz (sampling interval ranging from 2-0.5 msec) plus a single string of towed hydrophones (streamer) that determine geologic structure by detecting waves reflected by subsurface layers.";"2010-02-19"
"364";"1000 Hz top-bandwidth multi-channel seismic reflection systems";"";"An energy source with a frequency up to 1000 Hz (sampling interval ranging from 2-0.5 msec) plus a multiple strings of towed hydrophones (streamers) that determine geologic structure by detecting waves reflected by subsurface layers.";"2010-02-19"
"365";"2000 Hz top-bandwidth multi-channel seismic reflection systems";"";"An energy source with a frequency up to 2000 Hz (sampling interval ranging from 0.5-0.25 msec) plus a multiple strings of towed hydrophones (streamers) that determine geologic structure by detecting waves reflected by subsurface layers.";"2010-02-19"
"366";">2000 Hz top-bandwidth multi-channel seismic reflection systems";"";"An energy source with a frequency up to >2000 Hz (sampling interval lower than 0.25 msec) plus a multiple strings of towed hydrophones (streamers) that determine geologic structure by detecting waves reflected by subsurface layers.";"2010-02-19"
"367";">2000 Hz top-bandwidth sub-bottom penetrator and mud profiler systems";"";"Devices that provide information on unconsolidated sediment structure through transmission and reception of an energy source with a frequency corresponding to a sampling interval lower than 0.25 msec.";"2010-11-18"
"368";"seismometers";"";"Devices placed on the ground or seabed to measure physical movement of that substrate.";"2010-02-19"
"369";"hydrophones";"";"Devices containing transducers that convert underwater sound waves into electrical signals.";"2010-02-19"
"370";"geothermometers";"";"Instruments carrying a sensor that determines the temperature (degree of hotness) within geological units.";"2010-11-18"
"371";"60 Hz top-bandwidth single-channel seismic reflection systems";"";"An energy source with a frequency up to 60 Hz (sampling interval higher than 8 msec) plus a single string of towed hydrophones (streamer) that determine geologic structure by detecting waves reflected by subsurface layers.";"2010-02-19"
"372";"2000 Hz top-bandwidth single-channel seismic reflection systems";"";"An energy source with a frequency up to 2000 Hz (sampling interval ranging from 0.5-0.25 msec) plus a single string of towed hydrophones (streamer) that determine geologic structure by detecting waves reflected by subsurface layers.";"2010-02-19"
"373";">2000 Hz top-bandwidth single-channel seismic reflection systems";"";"An energy source with a frequency up to >2000 Hz (sampling interval lower than 0.25 msec) plus a single string of towed hydrophones (streamer) that determine geologic structure by detecting waves reflected by subsurface layers.";"2010-02-19"
"374";"60 Hz top-bandwidth multi-channel seismic reflection systems";"";"An energy source with a frequency up to 60 Hz (sampling interval higher than 8 msec) plus a multiple strings of towed hydrophones (streamers) that determine geologic structure by detecting waves reflected by subsurface layers.";"2010-02-19"
"375";"250 Hz top-bandwidth multi-channel seismic reflection systems";"";"An energy source with a frequency up to 250 Hz (sampling interval ranging from 2-8 msec) plus a multiple strings of towed hydrophones (streamers) that determine geologic structure by detecting waves reflected by subsurface layers.";"2010-02-19"
"376";"sediment surface markers";"";"Physical markers that allow changes in the position of the boundary between sediment and air or water by visible comparison against marked graduations in units of measurement of dimension length.";"2010-04-22"
"377";"water level markers";"";"Fixed physical markers that allow changes in the position of the boundary between a water body and the atmosphere by visible comparison against marked graduations in units of measurement of dimension length.";"2010-04-22"
"378";"sediment profile imagers";"";"Devices that provide in-situ still or video images of a section including bottom water, the undisturbed sediment-water interface and the upper sediment layers.";"2010-04-22"
"379";"altimeters";"";"Instruments that measure their distance above a specified elevation such as the sea surface or the seabed. Classification includes acoustic and pressure-based instruments that are designed to provide platform z co-ordinate spatial coverage in the atmosphere or a water body. It excludes remote sensing instruments such as LIDAR and satellite radar altimeters designed to map surface elevation.";"2012-12-18"
"380";"submarine cables";"";"Electrical conductors routed beneath the sea and connecting land stations.  Oceanographic interest focuses on changes in electrical resistance that may be related to the magnitude of Lagrangian currents.";"2010-09-15"
"381";"precipitation gauges";"";"Instruments that measure either the rate of fall or integrated amount of rain, snow, sleet, hail or graupel.";"2010-09-15"
"382";"atmospheric gas analysers";"";"In-situ instruments that can determine the proportion of one or more gaseous components of the atmosphere.";"2010-09-15"
"383";"metal analysers";"";"In-situ instruments that can determine the total, dissolved or particulate concentration of one or more metallic elements (including trace metalloids like arsenic) in a water body.";"2010-09-15"
"384";"ADVs and turbulence probes";"";"ADV is the acronym for acoustic doppler velocimeter. The group includes all in-situ instruments that make high frequency measurements of three-dimensional current velocity in order to determine the extent of turbulence within a water body.";"2010-09-15"
"385";"platform attitude sensors";"";"Instruments that measure platform orientation or rates of platform motion or acceleration in any direction or along any axis. Excludes inertial navigation systems that are designed to determine platform location with respect to an external co-ordinate reference system.";"2010-09-15"
"386";"Aerosol physical characterisers";"";"Instruments that determine physical attributes such as size and abundance of atmospheric aerosols.";"2010-10-01"
"387";"Aethalometers";"";"Instruments that quantify atmospheric particulate carbon ('black carbon') concentrations.";"2010-10-01"
"388";"flow meters";"";"Sensors that quantify the rate at which fluids (e.g. water or air) pass through sensor packages, instruments or sampling devices.";"2011-05-20"
"50";"sediment grabs";"";"A device that collects a sample of surface sediment including manually deployed equipment like a shovel or bucket.";"2007-11-20"
"51";"unconsolidated sediment corers";"";"Devices designed to collect samples of unconsolidated sediment from between the surface and depths from a metre to 10s of metres with minimal disturbance of the sediment structure.";"2010-07-20"
"52";"sediment porewater samplers";"";"A device that collects samples of pore water from various horizons below the seabed.";"2007-11-20"
"53";"rock corers";"";"A device that drills into rock extracting a cylindrical sample.";"2013-02-26"
"54";"rock dredges";"";"A device dragged across the seabed designed to collect loose rock samples.";"2007-11-20"
"55";"sediment settling tubes";"";"A specialised water bottle that both collects water samples and provides a settling velocity experiment apparatus.";"2007-11-20"
"56";"snow and ice samplers";"";"A device that collects a sample of frozen seawater or accumulated frozen precipitation.";"2013-02-26"
"57";"manual rock samplers";"";"A simple tool like a hammer, saw or even just a hand for the collection of rock samples.";"2013-02-26"
"58";"continuous air samplers";"";"A device that continuously supplies a flow of air either to an analytical instrument, over a sensor or from which discrete samples may be drawn.";"2013-02-26"
"59";"sampling extent markers";"";"Devices that label the region within which sampling is to be confined such as permanent quadrants and location markers.";"2010-04-22"
"60";"sediment dredges";"";"Bucket-like containers hauled over the sea bed collecting integrated samples of surface sediment along a segment of ship track.";"2010-07-20"
"61";"demersal trawl nets";"";"Nets towed over the sea floor designed to sample species living on or near the bottom.";"2010-07-30"
"62";"beam trawls";"";"Nets towed over the sea floor having the horizontal net opening provided by a wooden or metal beam that disrupts the surface of the bed.";"2010-07-30"
"63";"passive fishing gear";"";"Apparatus where capture is based on the movement of the target species towards the gear (e.g. creels and fish traps).";"2010-07-30"
"64";"active fishing gear";"";"Apparatus where capture is based on chasing the target species (e.g. a trawl).";"2010-07-30"
"65";"gill nets";"";"Nets drifting in the sea or standing on the sea floor in which fish become entangled, usually through their gill covers.";"2011-08-26"
"66";"flushing drills";"";"Devices primarily designed to drill wells through sediment or rock that flush the drill spoil back to the surface where it is examined to provide lithological data through the process known as mud logging.";"2011-08-26"
"67";"high-speed plankton samplers";"HSS";"A fine-meshed net or filter towed behind a moving vessel that collects a single sample for a tow. Samples microzooplankton, mesozooplankton and nekton.";"2011-11-25"
"68";"multinet";"";"A system comprising several nets that can be opened and closed sequentially to collect a series of samples during a tow or haul. Samples microzooplankton, mesozooplankton and nekton.";"2011-11-25"
"69";"neuston net";"";"A fine-meshed net designed to collect samples living within a few centimetres of the sea surface. Samples microzooplankton, mesozooplankton and nekton.";"2011-11-25"
"81";"shipboard incubators";"";"A device mounted on a ship that holds water samples under conditions of controlled temperature or controlled temperature and illumination.";"2008-01-10"
"82";"in-situ incubators";"";"A rig that allows water samples to be retained from where they were collected whilst physically separated from their surroundings.  Includes small-scale incubation rigs and mesocosms.";"2008-01-10"
"83";"centrifuges";"";"Devices that separate the liquid and solid phases of a sample through forces exerted by rapid rotation.";"2013-02-26"
"84";"sieves and filters";"";"Devices that separate solid particles larger than a particular size from a sample collected by another device that is a suspension of solid particles in a liquid or gas.";"2013-02-26"
"85";"biorectors and chemostats";"";"Devices in which controlled conditions are maintained for a chemical process to be carried out by organisms or biochemically active substances derived from such organisms.";"2012-08-02"
"90";"manual biota samplers";"";"A simple tool like a hammer, saw or even just a hand for the collection of biota samples.";"2013-02-26"
"91";"observers";"";"Humans who estimate a parameter through observation of a phenomenon such as bird counts and visual wave observations.";"2013-02-26"
"999";"unknown";"";"The correct value is not known to and not computable by the creator of this information. However a correct value probably exists.";"2007-11-20"
"AQPL";"Aquapulse";"";"A marine seismic source where a propane-oxygen mixture is exploded inside a steel cylinder.";"2010-10-18"
"ARAG";"airgun array";"";"A marine seismic source where multiple airguns of different sizes are tuned so that  a broader frequency spectrum will be generated.";"2010-10-18"
"ATRANS";"atmospheric transparency quantifiers";"";"Instruments that quantify the degree of scattering and absorption of light passing through the atmosphere, including instruments that quantify aerosol and particulate concentrations (e.g. black carbon) and instruments measure meteorological visibility.";"2013-04-23"
"BOMR";"Boomer";"";"A marine seismic energy source in which capacitors are charged to high voltage and then discharged through a transducer in the water. The transducer consists of a flat coil with a spring-loaded aluminium plate. Eddy currents force the plates to separate sharply, producing a low pressure region between the plates into which the water rushes generating a pressure wave by implosion.";"2010-10-18"
